{
  "seed": 424242,
  "currency": "INR",
  "locale": "en-IN",
  "channel": "upi",
  "clock": { "start": "2026-01-01", "days": 3, "then_stream_tps": 20 },
  "population": {
    "consumers": {
      "count": 30,
      "archetypes": [
        {
          "name": "salaried",
          "weight": 0.6,
          "income_pattern": {
            "kind": "fixed_credit_day",
            "day_of_month": 1,
            "amount_mean": 60000,
            "amount_stddev": 15000
          },
          "spend_rhythm": {
            "daily_transaction_count_mean": 3,
            "daily_transaction_count_stddev": 1,
            "weekend_multiplier": 1.3
          }
        },
        {
          "name": "gig_worker",
          "weight": 0.4,
          "income_pattern": {
            "kind": "irregular_weekly",
            "amount_mean": 9000,
            "amount_stddev": 3000
          },
          "spend_rhythm": {
            "daily_transaction_count_mean": 4,
            "daily_transaction_count_stddev": 1.5,
            "weekend_multiplier": 1.1
          }
        }
      ]
    },
    "merchants": {
      "count": 10,
      "categories": {
        "grocery": {
          "name": "grocery",
          "weight": 0.5,
          "amount_distribution": { "kind": "lognormal", "mean": 400, "stddev": 150 }
        },
        "electronics": {
          "name": "electronics",
          "weight": 0.5,
          "amount_distribution": { "kind": "lognormal", "mean": 4000, "stddev": 2500 }
        }
      }
    }
  },
  "seasonality": [
    { "event": "flash-sale", "window": ["2026-01-02", "2026-01-03"], "volume_multiplier": 1.5 }
  ],
  "fraud": {
    "target_rate": 0.15,
    "typologies": [
      {
        "type": "card_testing",
        "share": 0.34,
        "params": {
          "burst_size_min": 3,
          "burst_size_max": 6,
          "burst_window_minutes": 4,
          "amount_min": 1,
          "amount_max": 25
        }
      },
      {
        "type": "account_takeover",
        "share": 0.33,
        "params": { "dormancy_days": 1, "drain_step_count": 2 }
      },
      {
        "type": "refund_abuse",
        "share": 0.33,
        "params": { "refund_rate": 0.25, "max_refunds_per_actor": 3 }
      }
    ]
  },
  "outcomes": { "baseline_decline_rate": 0.02 },
  "imperfections": {
    "duplicate_delivery": { "rate": 0.05, "sinks": ["archive", "events"] },
    "late_arrival": {
      "rate": 0.05,
      "delay_seconds_mean": 10,
      "delay_seconds_stddev": 4,
      "sinks": ["archive", "events"]
    },
    "out_of_order": { "rate": 0.05, "sinks": ["archive", "events"] },
    "clock_skew": {
      "rate": 0.05,
      "sources": [
        { "source": "archive", "offset_seconds": 30 },
        { "source": "events", "offset_seconds": 30 }
      ]
    }
  },
  "output": {
    "sinks": [
      { "type": "file", "name": "archive", "format": "parquet" },
      { "type": "kafka", "name": "events" }
    ],
    "labels": "separate_export"
  }
}
